title,content
"나이지리아 시위 '심각'…대사관, 교민들에 '외출 금지' 당부","대사관 영사 담당 관계자는 이날 연합뉴스와 통화에서 ""어제부터 (경제중심) 라고스에서 시행된 통행금지가 (전체 36개주 가운데) 9개주로 확산됐다""면서 ""교민들에게 안전을 고려해 가급적 불필요한 외출을 하지 말아 달라고 공지했다""고 말했다. 나이지리아에는 상사 주재원 등 현재 약 200명의 교민이 체류하고 있는 것으로 대사관 측은 파악하고 있다. 이인태 대사도 ""시위가 심상치 않게 전개되고 있다. 사태가 심각하다""고 현지 분위기를 전했다. 이날 라고스 거리에서는 정부의 통행 금지령에도 불구하고 시위대가 이틀 연속 가두 점거 시위를 벌였다. 이날 젊은 시위대원들이 라고스 레키 톨게이트 광장 옆에 바리케이드를 세우는 가운데 총격이 벌어졌다고 AP통신은 전했다.  레키 광장에서는 전날 밤 시위대에 총격이 가해져 부상자가 속출하고 정확한 규모는 알려지지 않았지만, 사망자도 다수 발생한 것으로 전해진다. 로이터통신에 따르면 바바지데 산워올루 라고스 주지사는 21일 트윗에서 레키 광장 총격 사건으로 한 명이 라고스의 한 병원에서 숨졌다고 확인하면서 다만 사망자가 시위대원인지는 불확실하다고 덧붙였다. 시위대는 군이 총을 발사했다고 말하고 실제로 나이지리아 전체를 뒤흔든 관련 동영상이 소셜미디어 등에 퍼졌지만 군은 이를 부인하고 있다. 인구 1천400만명으로 나이지리아 최대도시인 라고스 전역에서 총격이 보고되는 가운데 공항 가는 고속도로, 주요 버스 정거장, TV 방송국 바깥 등에서도 총성이 들렸다. 이 때문에 나이지리아 해적들에 납치됐다가 50일만인 지난 16일 석방된 한국 선원 2명은 회사가 있는 가나로 복귀하길 희망하고 있지만, 공항 가는 도로가 막힌 데다 라고스 이민청 관계자들도 출근을 제대로 못한 채 출국 절차가 지연되고 있다. 선원 2명은 지난 8월 28일 서아프리카 토고 인근 해상에서 조업 중 피랍된 관계로 나이지리아 정식 입국 기록이 없어 출국을 위해선 라고스 이민청의 협조가 절실하다고 대사관 영사 관계자는 설명했다.  선원들은 신종 코로나바이러스 감염증(코로나19) 검사에서 다행히 음성으로 결과가 나왔다. 이런 가운데 무함마두 부하리 나이지리아 대통령은 21일 시위대가 요구한 경찰 개혁이 속도를 내고 있다면서 진정할 것을 당부했다고 로이터통신이 전했다. 앞서 나이지리아의 시위대 총격 장면예 세계가 경악한 가운데 조 바이든 미국 민주당 대통령 선거 후보는 나이지리아 시위에 대한 강경진압을 비판하면서 경찰개혁을 요구하는 평화시위를 지지한다고 밝힌 바 있다. 나이지리아 내에선 이번 시위와 관련해 머리에 총격을 받아 쓰러진 사망자 등 참혹한 모습의 동영상이 유포되고 있다. 동영상 가운데는 시위대 내에서 몽둥이 등으로 무장한 사람들이 다른 한 명을 집단 폭행하는 장면도 있다. AP통신은 젊은 시위대가 무장한 갱들의 공격을 받고 있다는 광범위한 보도가 있다면서 시위대는 갱들에 대해 ""경찰이 시위를 깨뜨리기 위해 보낸 것""이라고 주장하고 있다고 전했다. 나이지리아에선 지난 2주 넘게 경찰 가혹행위에 항의하는 시위가 벌어지고 있으며, 국제인권단체 앰네스티 인터내셔널은 지금까지 군경의 과도한 유혈 진압으로 최소 10명이 숨졌다고 전했다. 글로벌 리스크 평가 회사인 '베리스크 메이플크로프트'는 지난 7월 16일 보고서에서 코로나바이러스로 인한 경제적 충격이 불쏘시개 역할을 하면서 올 하반기 개발도상국에서 민간 소요와 불안정이 발생할 것이라고 분석한 바 있다. 그러면서 팬데믹(세계적 대유행)의 경제적 악영향으로 인해 촉발된 항의는 기존 불만에 불을 지를 가능성이 있다며 이러한 '퍼펙트 스톰'에 직면한 고위험 국가로 나이지리아 등을 지목한 바 있다.  퍼펙트 스톰은 여러 위기가 동시다발적으로 찾아오는 것을 말한다. 보고서는 또 주로 아프리카와 남미 등 37개 국가가 전례없는 가두 시위를 최고 3년간 맞닥뜨릴 수 있다고 내다봤다."
뛰는 정부에 나는 갭투자자…집주인 1명이 전세금 449억 떼먹고 잠적,"7일 국토교통부와 주택도시보증공사(HUG)가 국회 국토교통위원회 소속 김상훈 국민의힘 의원에 제출한 전세보증금 반환보증 사고 상위 30위 임대인 현황 자료에 따르면, 주민등록상 주소가 서울 양천구인 임대인(집주인) A씨가 2017년부터 올해 6월까지 임차인(세입자)에게 전세보증금을 돌려주지 못한 사례는 202건, 금액은 413억1100만원에 달했다. 올해 8월 말 기준으로는 220건, 449억4100만원으로 건수와 금액이 늘어난 것으로 확인됐다. 같은 기간 집주인이 세입자의 전세금을 돌려주지 못한 최다 사례, 최대 금액이다. HUG는 A씨가 저지른 사고 207건에 대한 전세보증금 423억8500만원을 세입자들에게 대신 갚아줬다. 전세금 반환보증보험은 집주인이 임차 계약 기간 만료 후에도 전세보증금을 돌려주지 못하면 가입자(세입자)에게 대신 보증금을 지급(대위변제)해주고 나중에 구상권을 행사해 집주인에게 청구하는 상품이다. 현재 공공 보증기관인 HUG와 민간 보증기관인 SGI서울보증에서 관련 상품을 취급하고 있다. 그러나 변제금 중 A씨에게 청구해 회수한 실적은 아직 없는 것으로 확인됐다. 등록 임대사업자인 A씨는 제도와 법의 허점을 이용해 빌라 분양업자·중개업자와 짠 뒤 다세대주택을 집중적으로 매입하고 전세보증금을 부풀린 것으로 알려졌다. 현재 잠적한 그가 보유한 임대 주택은 490채로, 세입자들은 대부분 신혼부부이거나 갓 취업한 사회초년생인 것으로 전해졌다. 보증보험을 통해 전세금을 대위변제 받은 207명을 제외한 나머지 세입자들은 아직도 피해 사실을 모르고 있거나 피해를 구제받을 방법이 사실상 없는 셈이다. 올해 6월 기준 서울 마포구의 B씨는 세입자 50명에게 전세금 101억5800만원을 되돌려주지 않았고 강서구의 C씨도 세입자 48명에게 전세금 94억8000만원을 갚지 않았다. 지방에서는 세입자 12명에게 28억6100만원의 보증금을 변제하지 않은 충남 예산군의 D씨가 최대 사고 금액을 기록했다. 올해 3년 6개월 동안 전세보증금을 반환하지 않은 임대인 상위 30명이 저지른 보증사고 건수는 549건, 사고 금액은 1096억4000만원으로 집계됐다. 이 가운데 HUG는 세입자에게 966억6400만원을 대신 갚아줬으나 이후 해당 집주인에 청구해 받은 회수금은 117억3100만원(12.1%)에 그쳤다. 특히 상위 10명 중 6명으로부터는 단 한 푼도 받아내지 못한 것으로 조사됐다. 보증기관인 HUG와 SGI서울보증의 전세보증금 반환보증 대위변제 미회수 금액은 매년 증가세로, 2016년부터 올해 9월까지 7654억원에 이르렀다. 올해 8월 말 기준으로 주택 유형별 전세금 대위변제 회수율은 아파트 74%, 단독주택 56%, 다가구주택 46%, 연립주택 43%, 오피스텔 34%, 다세대주택 22%로 나타났다. 상대적으로 가격이 낮아 갭투자가 용이하고, 서민들이 많이 거주하는 주거 상품일수록 회수율도 낮은 것이다."
한진重 입찰 KDB인베스트 등 7곳 참가,"한진중공업 매각에 KDB산업은행 자회사인 KDB인베스트먼트, 한국토지신탁 등 총 7곳이 겨루게 됐다. 26일 투자은행(IB)업계에 따르면 매각주관사인 삼일회계법인을 통해 진행한 한진중공업 매각 예비입찰에 KDB인베스트먼트·케이스톤파트너스 컨소시엄을 비롯한 7곳이 인수의향서(LOI)를 제출했다. 산은 자회사인 KDB인베스트먼트 외에 APC프라이빗에쿼티(PE), NH·오퍼스PE, 한국토지신탁도 참여했다. 유력 인수 후보로는 우선 KDB인베스트먼트·케이스톤파트너스가 꼽힌다. KDB인베스트먼트는 그간 대우건설에 이어 한진중공업 인수 의지를 나타낸 바 있다. 영도조선소 등 향후 개발 가치가 높은 부동산 자산을 보유하고 있는 한진중공업 인수를 통해 KDB인베스트먼트가 최대주주로 있는 대우건설과 시너지를 낸다는 방침이다. 한국토지신탁도 인수 후보로 거론된다. 부동산 분야에 풍부한 경험을 갖추고 있는 한국토지신탁 역시 영도조선소 개발사업을 감당할 만한 역량을 지닌 것으로 평가된다. 아울러 계열사인 동부건설과 한진중공업 건설 부문 간 시너지 효과를 낼 수 있다. 다른 인수 후보인 APC PE는 산은 중심 채권단에서 종합무역상사인 STX를 인수한 경험이 있다. 최근 흥아해운 인수전에서 STX 자회사인 STX마린서비스와 함께 STX컨소시엄을 구성해 본계약을 맺었다."
"벤츠의 다임러, 분기 순손실 2.5조원에서 순익 2.8조원으로","23일 다임러는 올 전체 영업이익이 코로나 이전의 지난해와 같을 것으로 전망했다. 이에 유럽에서 주가가 2.5% 치솟았다. 3분기 순익은 1년 전의 18억1000만 유로에서 19% 증가한 21억6000만 유로(25억4000만 달러, 2조8000억 원)에 달했다. 직전 2분기에는 코로나 록다운으로 순손실 19억 유로(2조5000억 원)를 기록했다. 판매 총수입은 7% 떨어진 402억8000만 유로였으나 비용 절감 효과에다 이윤이 보다 많은 차종의 판매 비중이 커져 이익이 되려 많아졌다. 메르세데스-벤츠 디비전이 비용 및 가격 효과로 순익 증가에 크게 기여했다. 판매 대비 이익 마진이 9.4%에 이르렀다. 다임러는 강한 캐쉬 플로우로 순 유동성이 131억 유로에 달해 전기차 및 디지털 서비스 등 새 기술 개발 재원이 풍부해졌다."
홍남기는 어쩌다 ‘전세 난민’ 샘플 신세가 됐나,"홍남기 경제부총리 겸 기획재정부 장관이 전셋집에서 내몰리고 자신의 집은 팔기 어려워진 사연은 임대차보호법뿐 아니라 문재인 정부 출범 후 나온 23차례 부동산 대책이 복합적으로 작용한 영향이 크다. 홍 부총리는 부동산 투기와 거리가 먼 ‘평범한 1주택자’지만 각종 규제가 이리저리 옭아매면서 선의의 피해자가 됐다는 분석이다. 홍 부총리의 사연이 주목받는 건 국민 상당수가 함께 겪고 있는 어려움이기 때문이다. 15일 부동산등기부등본과 고위공직자 재산신고 내역, 홍 부총리의 과거 페이스북 설명 등을 종합하면 홍 부총리는 2005년 경기 의왕에 아파트 한 채를 장만해 가족과 실거주했다. 그러다 2017년 12월 세종시 한 주상복합을 공무원 특별공급으로 분양받았다. 당시 홍 부총리가 실제 입주할 생각이 있었는지는 알 수 없지만, 1주택자가 새집으로 갈아타기 위해 분양받는 건 흔한 일이다. 당시엔 ‘1주택+1분양권’은 다주택자로 보지 않았다. 하지만 2018년 9·13 대책으로 상황이 돌변했다. 청약과 대출 땐 분양권도 주택으로 간주하고 규제에 나선 것이다. 무주택자의 청약 당첨 확률을 높이고 은행 돈을 이용한 투기를 막겠다는 의도였다. 하지만 아직 지어지지 않은 집인 분양권을 주택으로 볼 수 있느냐는 논란이 일었고, 홍 부총리도 이때부터 다주택자 ‘꼬리표’가 붙었다. 홍 부총리는 꼬리표를 떼고자 세종 분양권을 처분하려 했다. 그러나 입주(2021년 8월)까지 전매금지인 게 발목을 잡았다. 세종은 홍 부총리가 분양을 받기 4개월 전인 2017년 8·2 대책 때 투기과열지구로 지정됐고, 분양권 상태에선 전매가 불가능하다. 다주택 공직자에 대한 부정적인 여론이 들끓자 홍 부총리는 결국 지난 7월 의왕 집을 매물로 내놨다. 가족과 오랜 추억이 깃든 집이지만, 꼬리표를 떼려면 다른 방법이 없었다. 홍 부총리는 취임 직후인 지난해 1월 청와대와 국회에 갈 일이 많아지자 의왕 집을 세주고, 서울 마포에 전세를 얻었다. 집이 있음에도 직장 등의 이유로 다른 곳에 세들어 사는 경우는 드문 일이 아니다. 하지만 이후 발표된 부동산 대책으로 곤궁에 빠졌다. 전셋집 주인이 실거주를 통보하면서 내년 1월 계약 만료와 함께 나가야 한다. 하지만 지난 7월 개정 임대차보호법 시행으로 인근 전셋값이 급등하면서 살 집을 구하기 어려워졌다. 높아진 전셋값을 대출로 충당하는 것도 여의치 않을 것으로 보인다. 앞서 지난해 12·16 대책으로 시가 9억원 초과 주택을 보유한 경우 전세대출이 금지됐는데, 의왕 집 현재 시세가 이 기준에 걸쳐 있기 때문이다. 의왕 집은 지난 8월 9억 2000만원에 매매계약을 체결했으나 세입자가 임대차법 시행에 따른 계약갱신청구권을 행사하면서 불발될 위기에 처했다. 전입이 불가능해진 매수자가 주택담보대출이 막혀 잔금을 치를 수 없게 된 것이다. 의왕은 지난 6·17 대책으로 투기과열지구로 지정됐고, 대출을 받을 경우 6개월 내에 그 집으로 전입해야 한다. 사실 홍 부총리는 고위공직자라는 걸 빼면 평범한 사람에 가깝다. 스스로를 “피란민 출신 부모와 자신 모두 무(無)에서 시작했다”고 소개하는 홍 부총리는 ‘흙수저’였다. 홍 부총리의 재산 총액은 10억 6700만원으로 전체 국무위원 평균(27억 2300만원)의 절반도 되지 않는다. 홍 부총리가 평범한 사람이기에 23차례 부동산 대책의 피해를 고스란히 입고 있을 수 있다."
밤사이 대전서 코로나19 확진자 2명 추가,"밤사이 대전에서 코로나19 확진자 2명이 추가로 나왔습니다. 추가 확진자는 지난달 말레이시아에서 입국한 외국인 30대 남성으로, 2주 자가격리 해제를 앞두고 무증상 상태에서 양성 판정을 받았습니다. 또 다른 확진자는 감염 경로가 밝혀지지 않은 60대 남성으로 기침 등 의심 증상을 보여 진단 검사를 받은 결과 코로나19 확진 판정을 받았습니다."
정보화진흥원-KT 협력 ‘AI 체험교육’ 시범 운영,"한국정보화진흥원(NIA, 원장 문용식)과 KT(대표이사 구현모)는 청소년의 스마트폰 선용 및 지능정보기술 기반의 미래형 인재 양성을 지원하기 위해 중학생 대상 ‘인공지능(AI) 코딩 체험교육’을 시범 운영한다고 21일 밝혔다. 과학기술정보정통부와 NIA가 매년 실시하는 ‘스마트폰 과의존 실태조사’에 따르면 매년 전 연령대의 스마트폰 이용자(만 3세-69세) 중 청소년의 과의존 위험률이 가장 높은 것으로 보고되어 가정 및 관계 기관의 관심과 대책이 필요하다. 대상별 스마트폰 과의존위험군 비율은 2019 기준으로 청소년 30.2%, 유아동 22.9%, 성인 18.8%, 60대 14.9%이다. 이에 NIA와 KT는 ICT 트렌드에 발맞춰 청소년들이 ICT 활용역량과 창의적 문제 해결 능력을 개발해 자신의 꿈을 실현하고, 나아가 다가올 지능정보화 시대를 이끌어갈 수 있도록 대상 맞춤형 ‘AI 코딩 체험교육’을 준비했다. 본 프로그램은 ‘AI 코딩교육’과 ‘스마트폰 과의존 예방교육’으로 구성된다. 교육 참여자는 본 교육을 통해 지능정보사회의 핵심기술을 이해하고, 실용적으로 활용할 수 있는 방법을 체험할 수 있다. 뿐만 아니라 현재 자신의 스마트폰 이용습관을 점검하고, 생산적으로 이용하기 위한 동기와 선용 능력을 키우는 기회를 갖게 된다. 본 교육은 오는 11월 중 서울 지역에서 시범 운영된 후 내년에 다른 지역으로 확산될 예정으로 코로나19 확산 예방 및 안전한 교육환경 조성 지침에 따라 대면 또는 비대면 교육으로 진행된다. NIA 문용식 원장은 “ICT 역량은 창의적 문제 해결 및 정보화 역기능 대처 능력과 함께 지능정보사회의 기본적 소양이라고 생각한다”며 “청소년들이 4차 산업혁명 시대의 인재로 성장하는 데에 본 교육이 보탬이 될 것으로 기대한다”고 밝혔다."
"대전시, 국토부에 ‘도심융합특구’ 신청서 제출",정부가 대전을 비롯한 5개 광역시에 '제2의 판교 테크노밸리'로 불리는 도심융합특구를 건립하기로 한 가운데 대전시가 신청서를 제출했습니다. 대전시는 5개 자치구로부터 신청받은 후보지가 최대한 반영될 수 있도록 신청서를 작성해 국토부에 제출했다며 국토부가 현장 실사를 거쳐 2022년부터 특구 조성사업에 착수할 예정이라고 밝혔습니다. 도심융합특구는 판교 테크노밸리처럼 도심에 정주여건을 갖춘 고밀도 산업지구를 조성하는 사업입니다.
"""후보 낼까요?"" 민주당 투표 돌입...국민의힘 맹비난","더불어민주당이 내년 4월 보궐선거에서 서울·부산시장 후보를 내기 위한 전 당원 투표에 돌입했습니다. 국민의힘은 국민과의 약속을 깼다며 성추행 의혹을 부각하려 애썼고, 민주당은 후보 공천의 정당성을 강조하며 방어에 나섰습니다. 우철희 기자입니다. 더불어민주당 당헌 96조입니다. 이 당헌을 바꿔, 내년 4월 서울시장과 부산시장 후보를 공천하기 위한 전 당원 투표가 시작됐습니다. 이낙연 대표는 SNS로 투표 독려에 나섰습니다. 첫날, 당원들은 인증샷까지 올리며 적극 투표에 참여했습니다. 약속 번복이라는 비판에 대해선, 과거 자유한국당도 박근혜 전 대통령 탄핵으로 치러진 대선에 후보를 내지 않았느냐며 적극 방어에 나섰습니다. 국민의힘은 약속 파기라며 연일 공세를 이어갔습니다. 무공천 약속을 했던 사람이 문재인 대통령이었다고 강조하며 현 정권의 거짓과 위선이 쌓여가는 느낌이라고도 비꼬았습니다. 고 박원순 전 시장의 성추행 피해자가 민주당 이낙연 대표에게 보낸 질의서를 언급하며 후보를 내는 것은 피해 여성에 대한 사과가 아니라고도 지적했습니다. 민주당 전 당원 투표는 일요일까지 계속되고, 월요일 최고위원회의에서 최종 결과가 발표될 예정입니다. 후보를 공천하는 것으로 최종 결론이 나면 여야 모두 시장 예비 후보를 추리는 작업을 본격화할 것으로 보입니다. YTN 우철희[woo72@ytn.co.kr]입니다."
"[팩트체크] ""BTS에게 병역특례 주자"" 정치권 주장 살펴보니","민주당 노웅래 의원이 ""손흥민은 병역특례가 되는데 왜 BTS는 안 되냐""며 대중문화예술인도 특례 대상에 포함시키자고 주장했습니다. 팩트체크 이가혁 기자와 함께 그간의 논의 과정과 외국 사례까지 따져보겠습니다. 네, 손흥민 선수는 2018년 자카르타 팔렘방 아시안게임에 출전해 금메달을 땄죠. 규정상 '체육요원'으로 편입되는 요건을 충족한 겁니다. 손 선수처럼 체육요원이 되는 요건은 올림픽에서 3위 이상, 아시안게임은 1위입니다. 노웅래 의원의 주장은 '예술요원'에 관한 내용인데요. BTS 같은 대중문화예술인도 여기에 포함시키자는 주장이죠. 현형 제도는 병무청장이 정한 국제예술경연대회에서 입상 성적 상위 2명에 든 사람, 우리 전통 예술 분야의 경우 국내대회 입상 성적 상위 1명에 든 사람이 해당합니다. 국가무형문화재 전수교육 이수자도 됩니다. 이렇게 체육, 예술요원으로 편입이 되면 기초군사훈련 4주만 받고 자기 분야에서 34개월 근무하면서 544시간 봉사활동 하는 것으로 군 복무를 마칠 수 있습니다. 저희가 국회 지난 17대부터 20대 국회까지 병역특례와 관련해서 발의된 법안을 모두 분석해 봤습니다. 특례를 확대하겠다는 게 5건으로 가장 많았고요. 폐지와 축소도 각각 3건, 2건씩이었습니다. 하지만 법안 총 12건 중에 11건이 임기만료로 폐기됐습니다. 주로 대형 스포츠 이벤트를 계기로 여론이 좀 조성이 되면 의원들이 법안을 냈다가 여론이 사그라들면 진전 없이 폐기되는 경우가 많았습니다. OECD 회원국 중에서 징병제를 택한 나라는 우리를 포함해서 13개 나라입니다. 이 중에서 대중문화예술인을 위한 병역특례제도 이걸 따로 갖춘 나라는 없습니다. 모든 징병 대상자가 돈을 내고 면제 기회를 갖는 터키 같은 일부 사례를 빼곤 대부분 지금 우리나라가 갖고 있는 체육, 예술 분야만을 위한 특례제도 이 자체가 없습니다. 지난해 11월에 나온 입장인데요. 정부가 TF까지 꾸려서 1년 가까이 병역제도 개선안을 논의한 끝에 그 결과를 확정, 발표한 적이 있습니다. 그 내용은 BTS 등 대중문화예술인은 대체복무를 계속 줄이기로 한 정부의 기조 또 공정성, 형평성 등을 감안했을 때 대상에 포함하지 않기로 했다, 이렇게 밝혔습니다. 즉 분야를 막론하고 특례 인원을 이제 더 늘리지는 않는다는 게 정부가 오랜 숙고 끝에 내린 결과인데 그 결과가 나온 지 1년도 채 안 돼서 다시 또 정치권에서 BTS 병역특례 얘기가 나온 것이죠. 물론 그사이 BTS 위상이 더 높아졌고 또 특례 필요성에 대한 의견이 오가는 만큼 정부가 다른 방안을 낼지는 좀 더 지켜봐야 합니다. 한편 BTS는 과거 언론 인터뷰를 통해서 병역은 당연한 의무이고 국가의 부름을 언제든지 응할 예정이다, 이렇게 입장을 여러 번 밝힌 바 있습니다. 알겠습니다. 잘 들었습니다. 팩트체크 이가혁 기자였습니다."
“충북 2047년 고령 인구 비중 40.6%”,"오는 2047년에는 충북지역 전체 인구의 40% 이상이 65세 이상 고령 인구가 될 것이라는 전망이 나왔습니다. 통계청이 발표한 미래 인구 추정치를 보면 충북지역은 현재 17%인 65세 이상 고령 인구 비중이 10년 뒤인 2030년에 26.6%로 상승해 초고령 사회에 진입할 전망입니다. 또 2040년에는 35.9%로, 2047년에는 40.6%까지 고령 인구가 확대될 것으로 분석됐습니다."
밀리터리 버거도 출시했는데… 이근 대위 출연 광고 삭제한 롯데리아,"롯데리아가 최근 성추행 전과 논란이 인 인기 유튜버 이근 대위(사진 가운데)가 출연한 광고를 삭제했다. 이 전 대위는 롯데리아 ‘밀리터리 버거’의 모델이다. 롯데리아 측은 “유튜브와 SNS(사회관계망서비스)에 올린 이 전 대위 관련 콘텐츠를 모두 내렸다”고 13일 밝혔다. 롯데리아가 감춘 콘텐츠는 롯데리아 공식 유튜브 채널의 밀리터리 버거 광고 영상과 ‘버거 개인주의 밀리 터리버거’라고 쓰여 있는 홍보물 등이다. 회사 측은 최근 ‘빚투’(빚+미투)에 이어 유엔 허위 경력 의혹, 성추행 혐의로 유죄 판결을 받은 전력 등 각종 논란에 휘말린 이씨로 인해 브랜드 이미지가 타격을 받을 수 있다고 판단, 그와 관련된 콘텐츠를 모두 내리기로 했다. 하지만 모델 계약 해지 건 관련해서는 논의를 진행 중인 것으로 알려졌다. 롯데리아는 이 전 대위가 유튜브 콘텐츠 ‘가짜사나이’에서 훈련 교관으로 출연해 인기를 얻자, 지난달 28일 버거 원재료를 식판에 담아 취향대로 즐기는 밀키트형 신제품 밀리터리 버거를 출시하고 그를 모델로 전격 발탁했다. 이씨는 지난 2017년 11월26일 오전 1시53분쯤 서울 강남의 한 클럽에서 20대 여성의 엉덩이를 움켜잡아 추행한 혐의(공중밀집장소에서의 추행)로 이듬해 11월 벌금 200만원을 선고받았다. 이 전 대위는 자신의 유튜브 채널에 올린 영상에서 유엔 관련 경력을 허위로 기재했다는 지적에 관해선 “사실과 다르다”라고 부인했고, 성추행 사건에 대해선 “성추행 혐의로 처벌받은 것은 맞지만 명백히 성추행을 저지르진 않았다”라는 입장을 밝혔다."
