title,content
여 “공수처 1호 수사대상” 역공…야 “특검 안되면 장외투쟁” 경고,"반면 민주당은 이번 사건을 공수처 1호 사건으로 가져가야 한다고 주장했다. 특히 이날 오후 법무부가 김 전 대표의 진술에도 불구하고 검찰이 검사·수사관 비위, 야권 수사를 제대로 하지 않은 사실을 확인했다고 밝히자 여당은 야당을 재차 압박했다. 신영대 민주당 대변인은 이날 오후 기자들을 만나 “금융 사기 사건과 별개로 검사의 부당한 수사 개입이 있었다면 별도 수사가 필요하고 이것이 공수처 1호 사건이 될 수 있다고 본다”고 밝혔다. 야당의 특검 도입 주장에 대해서는 “당내에서 논의한 바 없다”며 선을 그었다. 신동근 최고위원과 최인호 수석대변인 역시 페이스북을 통해 이번 사건을 공수처에서 수사해야 한다는 입장을 밝히기도 했다. 당내에서는 라임·옵티머스 사건의 타깃이 국회의원, 검찰 등 공수처 주요 수사 대상자와 겹치는 만큼 오히려 공수처 출범의 명분이 될 수 있다고 보는 기류가 강하다. 한편, 옵티머스 투자자 명단에 포함된 김경협 민주당 의원은 이날 기자회견을 열어 ‘증권사 직원의 권유로 단순 투자를 한 것’이라는 입장을 밝혔다. 이어 “특검이 공수처 출범 지연 도구로 악용되어서는 안 되기 때문에 야당 몫 공수처장 추천위원 추천부터 하고 특검 결과에 대해 (이번 사건을 권력형 비리로 규정한 주 원내대표와) 서로 의원직을 걸고 책임질 것을 제안한다”고 주장했다. 의원직을 걸자는 김 의원의 주장에 대해 주 원내대표는 “뜬금없는 말”이라고 일축했다. 다만 주 원내대표는 특검 도입과 공수처장 후보 추천위원 관련 협상 가능성에 대해서는 “논의해보겠다”고 여지를 뒀다."
편의점 취업 상습 절도 30대 징역 1년,"편의점에 취업한 뒤 상습적으로 물건을 훔친 30대에게 징역형이 선고됐습니다. 청주지방법원은 사기와 컴퓨터 등 사용 사기 혐의로 기소된 34살 A 씨에게 징역 1년을 선고했습니다. A 씨는 지난해 4월부터 올해 5월까지 진천과 청주, 음성의 편의점에서 일하면서 340만 원 상당의 금품을 훔친 혐의로 재판을 받았습니다."
'9대 이하 차량시위 허용'에 추가 집회 신고 잇따라,"법원이 개천절에 소규모 차량 시위를 조건부로 허용한다는 판단을 내놓자 비슷한 방식의 집회 신고가 잇따르고 있습니다. 하지만 경찰은 대규모 시위로 확산할 가능성을 우려해 법원이 허용한 집회 외에는 모두 금지하겠다는 방침입니다. 나혜인 기자가 보도합니다. 개천절 서울 강동구 일대에서 9대 이하 소규모 차량시위를 조건부로 허가받은 보수단체가 추가 집회를 예고했습니다. 서울행정법원의 결정을 근거로 마포구와 서초구, 도봉구 등 5개 구간에서 같은 방식으로 집회를 더 열겠다고 신고한 겁니다. 이 밖에 다른 보수단체 1곳도 개천절 서초구와 광진구 일대에서 추미애 법무부 장관의 사퇴 등을 요구하는 소규모 차량시위를 신고했습니다. 법원이 내건 아홉 가지 조건만 지키면 되는 것 아니냐며 곳곳에서 집회를 열겠다는 입장입니다. 앞서 서울행정법원은 9명 이하 인원이 차량 한 대에 한 명씩만 타고 신고한 시간에, 신고한 경로로만 진행하는 조건으로 집회를 허용했습니다. 참가자들은 연락처와 차량 번호를 경찰에 미리 내야 하고, 집회 도중 창문을 열거나 구호를 외치면 안 되며, 집회 전후 대면 모임도 하면 안 되고, 다른 사람이나 다른 차량이 대열에 진입할 경우 행진하면 안 된다는 내용입니다. 이 같은 법원 결정 이후 잇따르는 추가 신고에 대해 경찰은 행정법원이 허가한 집회 외에는 모두 금지하겠다는 방침입니다. 주최 측이 개천절 애초 신고한 것보다 훨씬 큰 규모로 도로를 마비시키려는 계획을 모의한 정황이 있었던 만큼, 소규모 산발적 시위가 대규모로 확산할 우려가 있다고 보는 겁니다. 그러나 경찰이 추가 금지통고를 하면 신고 단체들이 또다시 집행정지 신청을 낼 수 있는 상황이라 개천절 집회를 둘러싼 긴장감은 여전합니다. 앞서 지난 8월 광복절 집회 때에도 법원이 소규모 집회를 허용하면서, 허용받은 집회에 여러 단체가 참여하는 '꼼수'로 인해 참여 규모가 커졌고 결국 코로나19 재확산의 계기가 됐다는 논란이 일었습니다. YTN 나혜인입니다."
김화군 수해복구 현지지도하는 김정은 국무위원장,공감언론 뉴시스가 독자 여러분의 소중한 제보를 기다립니다. 뉴스 가치나 화제성이 있다고 판단되는 사진 또는 영상을 뉴시스 사진영상부(n-photo@newsis.com)로 보내주시면 적극 반영하겠습니다.
'곰표·말표 맥주' 옛 상표 붙여 재탄생…'옛것이 새롭다',"요즘 편의점에 가면, 눈에 띄는 특이한 제품들이 있습니다. 밀가루 상표로 익숙한 곰과 구두약에 그려져 있던 말이 맥주로 변신했고요. 조미료인가 싶었는데 팝콘입니다. 옛날 브랜드를 엉뚱한 품목으로 탄생시킨 제품들인데요, 인기가 많습니다. 이문현 기자가 취재했습니다. 서울시내 한 편의점. 오랜만에 곰 그림 맥주가 입고돼 냉장고에 진열됩니다. 지난 5월, 출시 사흘만에 10만캔이 팔려나간 이 맥주는, 지금도 SNS 등에서 구하기 전쟁이 벌어지는 인기품입니다. 원래 제분회사 마크인 곰이 맥주에 붙어 대박이 나자, 과자와 화장품이 연이어 출시됐고, 이젠 오히려 원조인 밀가루 포장을 맥주처럼 해달라는 요청까지 쇄도하고 있습니다. 이 맥주의 선전에 힘입어, 최근엔 2탄 격인 말표 맥주도 나왔습니다. 입소문을 타고 출시 사흘만에 25만캔의 판매고를 기록했습니다. 이 뿐 만이 아닙니다. 더이상 편의점에서 찾아보기 힘든 한 두유는 지난 8월 아이스크림으로 만들어져 두달 만에 콘 아이스크림 매출 2위를 기록했고, 전통의 조미료 브랜드도 엉뚱하게 팝콘을 출시했습니다. 이런 상품들의 공통점은 기성세대에겐 익숙하지만 젊은층에겐 낯선 추억 속 브랜드를 새롭게 해석했다는 것. 이러면서 오히려 편의점을 주로 찾고, SNS를 즐겨 하는 젊은층에게 재미난 요소로 인식되고 있습니다. 관련 제품을 기획해 출시한 편의점들은 입소문을 타고 제품이 잘 팔려 좋고, 원조 브랜드를 갖고 있는 기업들도 적은 비용으로 브랜드 이미지를 강화해 좋습니다. 이런 추세 속에, 20년 전 캐릭터를 활용한 초코과자, 보일러 회사 브랜드를 사용한 핫팩 등, 오래된 브랜드를 재해석한 제품들이 편의점 업계의 새 트렌드로 자리매김하고 있습니다. MBC뉴스 이문현입니다. All rights reserved."
"어업인 배제된 일방적 해상풍력 추진, 이제 그만!","어업인이 배제된 채 일방적으로 추진되고 있는 해상풍력의 문제점을 지적하고 어업피해를 최소화하기 위한 정책 마련을 촉구하는 어업인의 목소리가 높아지고 있다. 수협 해상풍력대책위원회(이하 대책위)는 20일 산업통상자원부 청사(세종특별자치시 어진동) 앞에서 일방적 해상풍력 사업 추진을 반대하는 어업인 결의문을 낭독한 뒤, 해상풍력의 문제점과 어업인 요구사항을 담은 정책건의서와 서명부를 산업부, 해양수산부, 국무조정실에 각각 전달했다고 21일 밝혔다. 특히 이번에 정책건의서와 함께 제출된 서명부에는 지난 8월 27일부터 이달 8일까지 43일간 해상풍력 대책위가 전개한 ‘일방적 해상풍력 추진 반대 서명운동’에 참여한 53만 8337명의 전국 어업인과 일반 시민이 동참한 것으로 알려졌다. 대책위는 당초 예상을 상회하는 인원이 서명운동에 동참한 것은 정부와 민간사업자가 동·서·남해 할 것 없이 전국 바다에서 일방적·동시다발적으로 추진하고 있는 해상풍력사업의 병폐에 대해 어업인 뿐만 아니라 많은 시민들이 공감한 결과라고 평가했다. 최근 국정감사에서 농림축산식품해양수산위원회 뿐만 아니라 산업통상자원중소벤처기업위원회에서도 동시다발적으로 추진되는 해상풍력발전의 경제성 뿐만 아니라 어업인과 어장피해에 대한 위원들의 우려가 나오고 있다. 대책위는 정부에 어업인 요구사항과 서명부를 제출하는 것으로 멈추지 않고 향후 국회를 찾아 정당별 정책위원장 및 농해수위·산자위 상임위원장 면담을 추진키로 했다. 아울러 국회 차원의 정책 토론회 개최, 기자간담회 등을 통해 앞으로도 일방적인 해상풍력 사업 추진에 대한 어업인의 뜻을 강력히 전달하겠다고 밝혔다. 대책위 관계자는 “정부는 53만 명이 넘는 목소리에 응답해 해상풍력 병폐를 해소하고 어업피해 최소화와 어업인 권익보호를 위한 정책을 즉각 마련해야 한다”며 정부에서 지난 7월 17일 발표한 해상풍력 제도개선에 담긴 △입지적정성 평가 △어업인 참여 보장 △법·제도개선 등에 적극 나서 줄 것을 요구했다."
코로나19 확산기 '파리바게뜨' 소비자 관심 제빵사 '1위',"국내 주요 5개 제빵업체 중 국민들의 가장 많은 관심을 받은 제빵업체는 '파리바게뜨' 인것으로 나타났다. 소비자들의 호감도는 '신라명과'가 가장 높았다. 8일 글로벌빅데이터연구소(소장 김다솜)는 뉴스·커뮤니티·카페·유튜브·블로그·트위터·인스타그램·페이스북·카카오스토리·지식인·기업/조직·정부/공공 등 12개 채널 22만개 사이트를 대상으로 국내 첫 확진자가 발생한 1월 20일부터 10월6일까지 국내 주요 5개 제빵업체에 대한 빅데이터 분석을 실시했다고 밝혔다. 따삐오·로띠번·명랑시대쌀핫도그·못난이꽈배기·미스터도넛·브레댄코·블럭제빵소·코코호도(이상 가나다 순) 등은 주요 5개사에 비해 총정보량이 상대적으로 적은 편이어서 이번 집계에서는 제외했다. 분석 대상 제빵사는 ▲SPC그룹(회장 허영인)의 파리크라상(대표 황재복) '파리바게뜨' ▲SPC그룹 비알코리아(대표 김창대)의 '던킨도너츠' ▲CJ그룹(회장 이재현)의 CJ푸드빌(대표 정성필) '뚜레쥬르' ▲㈜파리크라상의 '파리크라상' ▲'신라명과'(대표 안희철, 조영장)등이다. 조사 결과 '파리바게뜨'의 포스팅 수가 총 23만 681건으로 압도적인 1위를 기록했다. 이어 '던킨도너츠' 13만 1925건, '뚜레쥬르' 10만 187건, '파리크라상' 1만 6301건 순이다. '신라명과'가 9498건으로  온라인 포스팅 수가 가장 적었다. 참고로 이번 조사에서 '파리바게트', '뚜레주르' 등 유사 키워드를 제외하는 등 엄격하게 집계한 영향도 일부 있음으로 인해 지난 1~5월 조사때와는 달리 던킨도너츠가 2위로 올라섰다. 5개 주요 제빵업체에 대한 국민들의 호감도를 조사해봤다. 조사 결과 관심도 최하위였던 '신라명과'가 순호감도 55.43%로 1위를 기록했다. 순호감도는 긍정률에서 부정률을 뺀 값으로 중립률은 고려하지 않았다. 관심도 1위였던 '파리바게뜨'는 39.20%로 2위를 기록했다. 이어 '파리크라상' 38.60%, '뚜레쥬르' 37.72% 순이었다."
‘영끌’ ‘빚투’ 나선 2030세대… 마이너스통장 한도액 급증,"올해 7개월간 2030 세대가 개설한 마이너스통장 한도액이 14조원을 넘긴 것으로 나타났다. 주식 열풍이 불고 집값이 상승하자 ‘빚투(빚내서 투자)’와 ‘영끌(영혼까지 끌어모음)’을 시도한 청년이 급속도로 증가한 것이라는 분석이 나온다. 4일 국회 국토교통위원회 소속 김상훈 국민의힘 의원이 금융감독원으로부터 제출받은 5대 시중은행(국민·우리·신한·하나·농협은행) 마이너스통장 개설 현황에 따르면 지난 1∼7월 2030 세대가 개설한 마이너스통장 한도액은 14조2011억원이다. 지난해 1년간 2030 세대가 개설한 마이너스통장 한도액이 16조4105억원인 것을 고려하면 올해 마이너스통장을 개설하려는 청년이 급속도로 늘어난 셈이다. 2017년부터 올해 7월까지 3년 7개월간 2030 세대가 만든 마이너스통장 계좌는 총 123만2123건으로 한도액은 62조4056억원이나 된다. 계좌 수는 이 기간에 개설된 전체 마이너스통장 계좌의 36.5%다. 최근 3년여간 마이너스통장을 개설한 3명 중 1명이 2030 세대라는 의미다. 지난해부터는 20대의 마이너스통장 개설이 부쩍 늘었다. 2017년 6만6936개, 2018년 6만9234개였던 20대 마이너스통장 신규 개설은 지난해 8만2538개로 1년 새 1만건 이상 급증했다. 올해는 7월까지 4만6454건의 마이너스통장이 20대 명의로 신규 개설됐다. 김 의원은 “문재인정부 3년간 가중되는 대출규제와 집값 상승, 취업난 등으로 청년세대가 내 집 마련을 위한 영끌, 주식투자를 위한 빚투에 나설 수밖에 없는 실정”이라며 “경기 침체가 오래갈수록 자산과 소득이 상대적으로 적은 청년세대에게 빚의 부담이 커질 수밖에 없다”고 지적했다."
"""월세 줄여달라"" 요구 가능...코로나 위기법 내용은?","21대 국회 첫 정기국회를 시작하면서 여야는 코로나19 관련 법안을 우선 처리하기로 합의했습니다. 이에 따라 소상공인이 임대료 감면을 요구할 수 있게 하는 등 코로나19 위기 극복을 위한 법안들이 잇따라 국회 문턱을 넘었는데요. 법안 통과로 어떤 점들이 달라지는지 김대근 기자가 정리했습니다. 코로나19와 사회적 거리두기의 직격탄을 맞은 소상공인들. 손님이 줄어든 만큼 임대료 등 부담은 커질 수밖에 없습니다. 이런 소상공인들의 부담을 덜어주기 위한 법안이 국회 문턱을 넘었습니다. 법 시행 후 6개월 동안 임대료가 밀리더라도 강제 퇴거를 제한하고, 코로나19 위기로 타격을 입은 경우 임대료를 깎아달라고 요구할 수 있는 게 핵심입니다. 다만 건물주가 임대료 감면을 거부할 수 있어 실효성이 떨어진다거나 코로나 위기의 어려움을 건물주에게만 전가한다는 지적은 풀어야 할 과제입니다. 코로나19로 대부분 수업이 온라인으로 대체되면서 대학가에서는 등록금 반환 요구가 잇따랐습니다. 국회를 통과한 고등교육법 개정안은 대학생들의 등록금 부담을 덜 수 있는 근거를 담았습니다. 코로나19 같은 감염병 확산으로 정상적인 수업을 받지 못하면 등록금을 면제하거나 감면하도록 했습니다. 하지만 강제성이 없어 효과가 떨어질 수 있다는 등 우려는 여전합니다. 또 감염병예방법 개정안이 국회를 통과해 감염병 전파 위험이 있는데도 방역 지침을 어긴 시설에 운영 중단을 명령하고, 감염병 환자와 의료인의 심리 치료 지원을 위한 근거도 마련됐습니다. 여야는 코로나19 법안을 우선 처리하겠다며 21대 국회 첫 정기국회의 문을 열었습니다. 약속대로 시급한 방역 조치와 지원을 위해 힘을 모으기 위한 노력을 이어갈지 여야의 움직임이 주목됩니다. YTN 김대근[kimdaegeun@ytn.co.kr]입니다."
[포토] ‘金추’된 배추,서울의 한 대형마트 직원이 4일 채소 진열대에 손질된 배추를 옮기고 있다. 한국농수산식품유통공사에 따르면 올해 고랭지 배추는 긴 장마와 태풍 등으로 생산량이 줄면서 1포기 소매 가격이 1만1883원으로 지난해보다 2배 가까이 치솟았다. 고랭지 무 1개 가격도 3870원으로 지난해 가격(2054원)보다 88% 이상 올랐다.
"북·중은 친선 과시, 한·미는 이상 징후… 위기의 ‘줄타기 외교’?","격화하는 미·중 갈등 속 우리 정부가 미국의 반중(反中) 캠페인 동참 요청에 난색을 보이는 가운데, 북·중 간 밀착은 날로 강해지는 모습이다. 어정쩡한 ‘줄타기 외교’를 고집하다 미·중 양쪽의 외면을 받고 남북 관계의 주도권마저 상실할 수 있다는 우려가 나온다. 조선중앙통신은 시진핑(習近平) 중국 국가주석이 신(新)중국 건국 71주년을 맞아 김정은 북한 국무위원장이 보낸 축전에 답전을 보냈다고 29일 밝혔다. 시 주석은 24일 자로 보낸 답전에서 “전통적인 친선을 대를 이어 계승 발전시키며, 두 나라와 두 나라 인민에게 보다 훌륭한 복리를 마련해주고 지역의 평화와 안정, 발전을 추동할 용의가 있다”고 밝혔다. 두 나라는 최근 중국의 6·25 전쟁 참전 70주년을 고리로 연일 친선을 과시하는 모습이다. 시 주석과 김 위원장은 이달에만 두 차례에 걸쳐 친서를 주고받으면서 대내외에 북중 친선 관계를 연일 부각하고 있다. 미·중 갈등 속 우군이 필요한 중국과 대미 협상력을 끌어올리려는 북한의 이해관계가 맞아 떨어졌다는 분석이 나온다. 이런 가운데 최종건 외교부 1차관은 이날 MBN과 동아시아연구원이 개최한 외교전략포럼 기조 발언에서 미·중 갈등으로 한국이 압박받는 외교 상황에 대해 “우리 스스로의 선택지를 제약할 필요는 없다”고 밝혔다. 미국의 압박에도 불구하고 ‘안보는 한미 동맹, 경제는 개방’이라는 대원칙 아래 전략적 모호성을 유지하겠단 뜻으로 해석됐다. 최 차관은 “한미 동맹을 서로 도움 주고 도움 받는 미래지향적 방향으로 발전시켜 나가는 한편 한·중 전략적 협력 동반자 관계를 더욱 내실 있고 성숙한 단계로 발전시키고자 한다”고 했다. 외교가에선 한국의 줄타기 외교가 미·중 양쪽에서 소외되는 결과로 이어질 수도 있다는 말이 나온다. 앞서 마이크 폼페이오 장관은 아시아 4국 순방에 나서면서 한국을 제외하는 등 우리 외교의 근간이 되는 한미 동맹의 이상 징후가 빈번하게 감지되고 있다. 폼페이오 장관은 이달 초에도 한국을 건너뛰고 도쿄만 방문해 다자안보협의체 쿼드(Quad) 외교장관 회의에 참석했다. 우리 정부가 유보적인 입장을 취하고 있는 사이 호주·일본·인도 등 쿼드 회원국들은 결속력을 다지고 있는 모습이다. 쿼드 회원국들은 다음 달 인도양과 아라비아해에서 열리는 군사훈련 ‘말라바르’에 함께 참여하기로 했다. 또 미국과 인도는 27일 인도 뉴델리에서 연례·국방장관(2+2) 회의를 열어 위성 정보 공유와 무기 구매 등 군사 협력 방안에 합의했다. 미국과 인도가 최근 2년 사이 세 차례나 2+2 회의를 개최한 반면, 한·미는 2015년 2+2 회의 때 이를 정례화하기로 했지만 문재인 정부 출범 이후 한 번도 열리지 못했다. 마이클 그린 미 국제전략문제연구소(CSIS) 일본 석좌는 26일(현지 시각) 논평을 통해 “일본이 동남아의 지역 안보 허브로 떠오르고 있다”고 평가했다. 그는 “미국의 인도·태평양 전략에 따라 호주, 일본 등 동맹 간 협력이 향상되고 있다”며 한국에 대해선 “(특별한 교류나 가까워지기 위한 노력이 없는) 평행 놀이(parallel play)를 하고 있다”고 했다. 국책연구소 관계자는 “미·일 양국이 ‘자유롭고 열려 있는 인도·태평양’ 원칙에 따라 동남아 지역에서 활동을 강화하고 있지만, 한국은 여기서 소외됐다는 것을 의미한다”고 했다."
제주 교통유발부담금 36억 원 첫 부과,"제주 첫 교통유발부담금이 부과됐습니다. 제주시는 올해 교통유발부담금 부과 대상을 3천3백여 건으로 확정하고, 21억7천여만 원을 부과했다고 밝혔습니다. 서귀포시도 천백여 건에 대해 14억6천여 만 원을 부과했습니다. 교통유발부담금은 교통난을 유발하는 일정 규모 상업시설에 부과하는 금액으로, 제주도는 올해 코로나19 여파로 부담금 50%를 경감했습니다."
"'박원순 성추행 의혹' 피해자, 이낙연 대표에 공개 질의...""대체 뭘 사과한다는 겁니까""","고(故) 박원순 전 서울시장 성추행 의혹 사건의 피해자인 전직 시장 비서 A씨가 30일 이낙연 더불어민주당 대표의 '사과 발언'에 대해 공개 질의했다. 전날 이 대표는 내년 서울·부산시장 보궐선거 후보 공천 방침을 밝히면서 ""특히 피해 여성께 마음을 다해 사과드린다""고 말했다. A씨는 이날 '서울시장 위력 성폭력 사건 공동행동'을 통해 낸 '박원순 성추행 피해 여성이 이낙연 민주당 대표에게 보내는 질문'에서 ""도대체 무엇에 대해 사과하신다는 뜻이냐""며 ""당 소속 정치인의 위력에 의한 성추행을 단속하지 못한 것이냐, 지지자들의 2차 가해 속에 저를 방치하고 있는 현실에 대해 사과하는 것이냐""고 물었다. 그는 이어 ""사건 공론화 이후 더불어민주당이 지금까지 집권 여당이자 해당 정치인의 소속 정당으로서 어떤 조치를 취했냐""고 비판했다. 공동행동은 ""피해자와 피해자지원단체, 공동변호인단은 더불어민주당으로부터 그 어떤 사과도 받은 적이 없다""며 공개 질의 배경을 설명했다. 아래는 A씨의 공개 질문 전문. 이낙연 더불어민주당 대표님께 질문 드립니다."
"'조국 똘마니전(戰)' 참전한 김근식 ""뒷끝작렬"" ""쫌스러워""","자신을 ‘조국 똘마니’라고 지칭했다고 진중권 전 동양대 교수를 명예훼손 혐의로 고소한 김용민 더불어민주당 의원에 대해 국민의힘 서울 송파병 당협위원장인 김근식 경남대 교수가 8일 ""똘마니 소리보다 쫌스럽다는 평가가 더 기분나쁘겠다""고 했다. 김 교수는 이날 페이스북에 ""최강욱 의원에게 똘마니 소리들은 검사장들과 윤석열 검찰총장은 왜 최강욱을 소송하지 않느냐""며 이렇게 말했다. 김 교수는 ""'똘마니' 검사장과 '똘마니 대장' 윤석열은 욕에도 크게 개의치 않은 모양""이라며 ""검사장과 윤총장은 여당의원의 똘마니 소리를 그저 그러려니 흘려 듣거나, 화가 나고 기분이 상해도 굳이 소송까지는 않겠다는 관용의 수준이 높은 것""이라고 했다. 김 교수는 ""정치인은 검사장과 검찰총장보다 훨씬 더 자주 더 심하게 공격과 비난을 받는 공인인데,  똘마니 소리들은 의원님이 발끈하고 소송하는 모습""이라며 ""똘마니 소리에도 무심하게 용인하는 검사장과 총장에게 창피하지 않을까""라고 했다. 김 교수는 지난 7일에도 페이스북에 글을 ""민주사회를 위한 변호사 모임(민변) 출신의 진보연하는 현직 여당 의원이 자신에게 정치적 비난을 했다는 이유로 소송을 제기했다""며 ""진짜 속이 좁은 뒤끝 작렬""이라고 했다. 그러면서 ""진 전 교수에게 사과를 원하면 힘없고 빽 없는 당직사병이 권력자에게 집단린치 당했는데도 끝까지 사과를 거부하는 추미애 장관에게도 똑같이 엄중하게 사과를 요구하라""고 했다. 김 교수는 ""조국에 쓴소리 한마디 못하고 조국 비호에 나서는 게 진보라면 그런 진보는 아니다""라며 ""(금 전 의원은) 진보라고 자처하는 민변 출신 여당 의원이 말꼬투리 잡아서 마치 힘없이 당한 당직 사병인 냥 소송하는 게 진보답지 않다고 비판한 것""이라고 했다."
"김태년 ""청문회 보다는 남북 공동 조사 이뤄져야""",더불어민주당 김태년 원내대표는 서해상 피격 사건에 대한 국민의힘의 청문회 필요성 주장과 관련해 남북 공동 조사가 우선이라고 다시 한번 강조했습니다. 김태년 원내대표는 오늘 국회에서 열린 기자간담회에서 청문회를 하면 우리 군 당국만 조사할 수밖에 없는데 이렇게 하면 사실관계를 밝혀내기 어렵다고 밝혔습니다. 이어 민간인 사살은 반문명적이고 야만적인 행위라며 이를 철저하게 규명하기 위해 남북 공동 조사가 반드시 필요하다고 덧붙였습니다.
