title,content
"'수소차'타고 온 文대통령, 52년 만에 靑북악산 철문 직접 열었다","문재인 대통령이 31일 1968년 북한의 청와대 기습 시도 사건인 '김신조 사태' 이후 52년 동안 굳게 닫혀 시민들의 출입을 통제했던 북악산 성곽 북측면 철문을 직접 열었다. 1968년 무장공비 침투 사건(1·21 사태) 이후 일반인의 출입이 제한됐던 북악산 길은 다음달 1일부터 부분 개방된다. 청와대 뒤편 북악산 북측면 구간이 열리면서 52년 만에 시민 품으로 돌아간다. 문 대통령은 개방을 하루 앞두고 최종 점검 차원에서 산행에 나섰다. 산악인 엄홍길 대장과 배우 이시영 씨, 종로구 부암동에서 30여 년간 거주한 주민 등과 함께 둘레길을 따라 산행했다. 오전 10시쯤 북악산 성곽 북측면 제1출입구(부암동 토끼굴) 부근에 도착한 문 대통령은 관리병으로부터 열쇠를 받아 철문을 직접 열었다. 북악산 전면 개방은 문재인 대통령의 대선 공약 중 하나였다. 문 대통령은 2017년 1월 ""대통령 집무 청사를 광화문으로 옮기고 청와대와 북악산을 국민에게 돌려 드리겠다""며 ""청와대는 수도 서울을 상징하는 시민 휴식 공간으로 만들겠다""고 공약한 바 있다. 대통령 공약 이행 차원에서 이번 일정은 더욱 의미있다는 게 청와대의 설명이다. 청와대는 ""지난 52년간 굳게 닫힌 북악산을 개방해 시민에게 돌려준다는 상징적 의미를 담고 있다""고 설명했다. 문 대통령은 북악산 제3출입구(청운대 안내소)에 도착해 문화재청장과 종로구청장으로부터 북악산 개방 준비 과정, 개방 후 관리 계획에 대해 설명을 들었다.문 대통령은 설명을 다 듣고선 ""우리 종로구청장님이 스스로 홍보를 잘 못 하시니까""라고 웃으며 운을 뗀 뒤 추가 설명에 나섰다. 문 대통령은 ""안산으로부터 인왕산, 북한산의 형제봉까지 쭉 연결될 수 있게 됐다""며 ""현재 안쪽 성곽로를 따라서 걷는 탐방로만 개방돼 있는데 늦어도 2022년까지는 청와대 위, 북쪽도 전면적으로 개방하는 게 목표""라고 전했다. 문 대통령과 일행들은 청운대 안내소로 이동하여 입산 비표를 수령하고 청운대 쉼터로 향했다. 문 대통령은 전면 개방 속에서도 철저한 경계 태세 필요성도 당부했다. 문 대통령은 ""일반인들은 (개방하지 않았던 이유가) 청와대 경호 때문이라고 생각하고 있는데, 청와대 경호뿐 아니라 수도 서울의 영공방위를 담당하고 있는 곳""이라며 ""개방을 하더라도 과학적인 방법으로 경계를 더 철저하게 강화시켜야 한다""고 요청했다. 문 대통령은 또 ""서울은 1000만 명 이상이 모여 사는 세계적인 수도인데 서울처럼 도시성벽이 남아 있는 나라가 거의 없다. 산은 있되 접근 못 하는 곳이 많은데 개방해서 시민이 향유하게 되면 숲을 시민에게 돌려드린다는 의미도 있고, 도시의 녹지공원 면적이 늘어나 삶의 질이 높아질 수 있다""며 개방 의미에 대해 설명했다. 문 대통령은 등산 도중에 부암동의 아름다움에 대해서도 언급했다. 문 대통령은 ""부암동은 종로구가 자랑할 만한 정말로 환상적인 곳""이라며 ""옛날에 '고향의 봄'에 꽃피는 산골이 연상될 만큼 봄철 되면 여러 가지 꽃들이 만발했다""고 돌이켰다. 이어 ""세상에 나쁘기만 한 일이 없다""며 ""출입이 금지 되도 한양도성이 온전하게 잘 보존됐다. 개방된 곳은 다 훼손됐지 않았나""라고 물었다. 그러면서 ""강남을 가보면 정말로 굉장하지 않는가. 거기에서 한강 다리를 건너 강북으로 넘어오면 뭔가 템포가 하나 느려지는 것 같고, 자하문 터널을 지나오면 그때부터는 완전히 슬로우 비디오로 느껴진다""고 했다. 문 대통령과 엄 대장은 각자의 히말라야 등반 경험에 대해서도 이야기를 주고받았다. 문 대통령은 2016년 히말라야 트래킹을 다녀온 적 있었다. 엄 대장은 등산 도중 ""코로나 백신이 따로 없다. 산이 백신, 자연이 백신""이라며 문 대통령은 ""실제로 탐방로를 찾는 숫자가 늘었다""고 화답했다. 문 대통령은 배우 이시영 씨에겐 ""산하고 인연이 있나""라고 물은 뒤 예전 복싱에 도전했던 것도 언급하며 챙겼다. 이에 이 씨는 ""산을 좋아해 유튜브에 등산 채널을 하고 있고 촬영 없는 날은 전국의 산을 다닌다""며 일정 초대에 고마움을 표했다. 정재숙 문화재청장은 청운대 쉼터에서 곡장 전망대로 이동하는 동안 한양도성 축조 시기에 따라 성벽 구조물이 각기 다른 모양으로 설치됐다며, 한양도성이 갖는 문화재적 가치를 강조했다.이에 문 대통령은 ""성벽의 역사를 볼 수 있게 해달라""고 당부하며 ""우리 나름대로 돌을 쌓는 방법이 있는데 현대식 돌담 쌓듯이 딱딱 잘라서 (크기를 똑같이) 하지 말고 복원하는 구간만이라도 옛날식으로 해달라""고 당부했다. 곡장 전망대에 오른 문 대통령은 남대문까지 일직선으로 쭉 뻗은 광화문 거리를 바라보며 ""광화문 재구조화 작업은 시작이 된 것인가""라고 물었다. 또 ""과거 의정부 터라든지 월대 같은 것이 다 복원되는가""라고 묻기도 했다. 그러면서 ""우리나라 사람들이 산을 정말 좋아한다""면서도 ""사람들이 많이 오면 올수록 화재 위험 같은 것은 있으니 산림청의 어깨가 자꾸 무거워지겠다""고 말한 뒤 화재 예방에 만전을 기해줄 것을 당부했다. 4출입구에서 북악산 등반을 마친 문 대통령은 백사실 계곡과 백석동천으로 이동해 주말 산행 나온 주민들과도 인사를 나눴다. 하산까지는 총 2시간 18분이 소요됐다. 엄 대장은 문 대통령과 헤어지며 ""대통령님, 히말라야 기운 드린다. 히말라야 기운""이라고 말하면서 일동 웃음을 자아내게 했다. 문 대통령은 이번 일정에도 수소 전용차인 '넥쏘'를 타고 왔다. 이번 개방은 문재인 정부 출범 이후 2017년 청와대 앞길 24시간 개방과 2018년 인왕산길 완전 개방에 이은 세 번째 청와대 인근 지역 개방이다. 대통령 경호처는 순차개방을 통해 오는 2022년 상반기에는 북악산 남측면을 개방할 예정이다."
피해자 한 서린 '형제복지원'...비상상고로 위로받을까?,"군사정권 시절 최악의 인권유린 사례로 꼽히는 '형제복지원' 사건, 가해자들은 무죄판결을 받았지만, 살아남은 피해자들은 고통 속에 삶을 버티고 있습니다. 검찰이 과거 판결을 바로잡아달라며 2년 전 신청한 비상상고 사건을 대법원이 심리하고 있는데, 피해자들에게 작은 위로가 될 결정이 나올지 주목됩니다. 박서경 기자입니다. 피해자들이 증언하는 형제복지원 사건, 그리고 이후의 삶은 끔찍하고 절망적입니다. 부랑자를 선도한다는 명목으로 세워진 형제복지원에서는 1975년부터 12년 동안 매년 3천여 명이 갇혀 강제로 노역했습니다. 구타와 학대, 성폭행이 자행됐고, 파악된 사망자만 5백 명이 넘습니다. 형제복지원 원장이던 고 박인근 씨 등이 불법감금 등의 혐의로 1987년 재판에 넘겨졌지만, 정부 훈령에 따른 것이었다며 대법원은 무죄를 확정했습니다. 2년 전 문무일 당시 검찰총장은 과거 판결이 잘못됐다며 대법원에 비상상고를 신청했습니다. 확정된 형사판결이 위법하니 다시 심리해달라고 검찰총장이 대법원에 요청하는 절차입니다. 부랑자를 영장 없이 가두도록 한 옛 내무부 훈령이 헌법에 어긋나며, 이를 근거로 한 무죄 판결은 부당하다는 게 검찰 주장입니다. 하지만 검찰의 신청이 받아들여지더라도 과거 무죄판결이 유죄로 바뀌는 건 아닙니다. 비상상고는 사실관계를 처음부터 따져 다시 판결하는 재심재판과는 다르기 때문입니다. 기존 판결에 법적 위반사항이 있는지만 확인할 뿐, 피고인에게 유리한 재판결과를 불리하게 뒤집을 수 없습니다. 다만 사법부 스스로 잘못 판결했다고 인정하는 의미와 함께, 피해자들이 국가를 상대로 손해배상을 청구하는 근거는 될 수 있습니다. 대법원은 지난 4월 한차례 변론을 진행한 데 이어 오는 15일 한 번 더 재판을 열어 형제복지원 사건을 심리하기로 했습니다. 이르면 올해 안에는 결론이 나올 것으로 보입니다. 33년 전 세상에 알려진 참혹한 인권유린 사건의 피해자들은 여전히 악몽에 시달리고 있습니다. 대법원이 이들의 상처를 조금이나마 위로할 수 있는 결정을 내릴지 주목됩니다. YTN 박서경입니다."
931회 로또 1등 당첨자 8명 '29억원씩'…모두 자동선택,"당첨번호 6개를 모두 적중시킨 1등은 8명으로 29억5710만8063원씩 받는다. 이들 모두 자동선택으로 1등에 당첨됐다. 당첨번호 5개와 보너스 번호가 일치한 2등은 54명으로 7301만5014원씩을 수령한다. 5개 번호를 맞춘 3등 2596명은 151만8803원을 각각 받는다. 당첨번호 4개를 맞힌 4등(고정 당첨금 5만원)은 12만1943명, 당첨번호 3개가 일치한 5등(고정 당첨금 5000원)은 204만1653명이다. 1등 배출점은 행운복권(서울 노원구), 나라시스컴(서울 영등포구), 복권방(부산 사하구), 로또복권(인천 서구), 가두판매점(경기 안양시), 창미슈퍼(경기 화성시), 이마트24 순천단산점(전남 순천시), 365팡팡복권(경남 김해시) 모두 8곳이다. 당첨금 지급기한은 지급개시일로부터 1년이다."
“전두환 불출석 왜 허가?”…국감서 광주법원 질타,오늘 국정감사에서 사자명예훼손혐의로 재판 중인  전두환 씨의 불출석을 허가한 광주지방법원에 대한 질타가 이어졌습니다. 또 조세포탈 혐의 재판에 1년 넘게 모습을 드러내지 않고 있는  허재호 전 대주그룹 회장 문제도  도마에 오르는 등 법원이 피고인 재판 출석 기준을 엄격히 적용해야 한다는 지적이 잇따랐습니다. 박지성 기자의 보도입니다. 알츠하이머 등 건강을 이유로 법정에 서지 않고 결심 공판까지 받은 전두환 씨. 국회 법제사법위원회 위원들은  전씨가 골프를 치고 연회를 즐긴 사실이 확인됐는데도 불출석 허가를 했던 광주지방법원을 거세게 질타했습니다. 또 다음달 30일 열리는 전 씨에 대한 1심 판결이  역사적 진실을 밝히는 출발점이라는 점도 강조했습니다. 5억 여원의 조세포탈 혐의로 기소된 허재호 전 대주그룹 회장의 재판도 도마에 올랐습니다. 뉴질랜드에 머물고 있는 허 전 회장은  귀국이 어렵다며 1년 2개월째 재판을 미루고 있습니다. 이 밖에도  광주시의 민간공원 사업 비리 의혹에 대한 재판이 지연되고 있다며 적정한 기간 내에 처리하라는  지적도 이어졌습니다. KBS 뉴스 박지성입니다.
공수처 출범 '첫발'…국민의힘 '처장' 추천위원 확정,"검찰을 견제할 고위공직자 범죄수사처, '공수처 법'이 시행된 지 100일이 지나도록 공수처장으로 추천할 위원 선정을 미뤄오던 국민의힘이 오늘 추천위원을 확정하고 다음주에 명단을 제출하겠다고 밝혔습니다. 조명아 기자입니다. 여당이 최후 통보한 추천 시한을 사흘 남긴 어제 밤, 국민의힘 주호영 원내대표는 라디오방송에 출연해, 공수처장을 추천할 야당몫 위원 2명을 준비하고 있다고 알렸습니다. 내정된 추천위원은 사법연수원 동기인 임정혁 변호사와 이헌 변호사입니다. 임 변호사는 대검찰청 차장 출신으로 드루킹 특검 후보에 오른 '공안통'으로 알려져 있고, 이 변호사는 박근혜 정권 당시 새누리당 몫의 세월호참사특조위 부위원장을 맡았습니다. 민주당은 일단 한 고비를 넘게 된 데 대해 ""늦었지만 다행""이라며, 조속한 공수처 출범을 거듭 촉구했습니다. 여당 내 일각에선, ""출범의 첫발을 내딛게 됐지만 야당 추천위원들이 공수처장 임명을 합법적으로 막을 수 있다""는 우려도 나옵니다. 정의당도 논평에서 ""추천위원 면면을 볼 때 만시지탄이 아닐 수 없다""며, 같은 우려를 나타냈습니다. 공수처장 후보는 추천위원 7명 가운데 6명이 찬성해야 후보로 추천될 수 있습니다. 야당이 석 달 넘게 끌어온 추천위원 문제를 매듭지을 경우, 별도로 제출된 공수처법 개정안 논의는 일단 가라앉을 것으로 보입니다. 여야 추천위원은 다음 주 초 확정 발표될 예정입니다. MBC뉴스 조명아입니다. All rights reserved."
시·도 국정감사 국회에서 열려…광주는 22일,"국회 행정안전위원회가 각 시·도와 경찰청 국정감사를 국회에서 한꺼번에 하기로 했습니다. 국회 행정안전위원회는 코로나19 방역 등을 감안해 서울과 경기를 제외한 나머지 지방자치단체와 기관의 국정감사를 당초 계획한 대상 기관이 아닌 국회로 변경했습니다. 이에 따라 광주시는 세종시와 대전, 울산시와 함께 오는 22일 국회 행안위 회의실에서 국정 감사를 받습니다. 광주지방 경찰청에 대한 감사는 이튿날인 23일 열립니다."
서울 곳곳 99명 집회…민노총·공공운수노조·자유연대 등,"토요일인 24일 서울 곳곳에서는 방역당국의 지침에 맞춘 참가자 100명 미만의 소규모 집회가 열렸다. 민주노총은 이날 오후 2시부터 영등포역·여의도역·전경련회관 앞 등에 집결해 '전태일 3법' 입법을 촉구하는 내용의 깃발과 피켓을 들고 국회 앞까지 행진했다. 건설산업연맹과 공공운수노조, 금속노조 등도 마포·여의도·종로 등에서 각각 99명 규모의 결의대회를 열고 ""비정규직을 철폐하고 중대재해기업처벌법을 제정하자""고 주장했다. 같은 시각 자유연대는 종로구 현대적선빌딩 앞에서 대통령 퇴진 등을 요구하는 집회를 열었다. 집회 시작이 가까워져 오자 60여명의 참가자가 모여 체온을 측정하고 명단에 연락처를 기재했다. 이들은 빌딩 앞 약 2개 차로에 띄엄띄엄 의자를 놓고 앉았다. 개천절과 한글날 서울 곳곳에서 '드라이브 스루' 차량 시위를 펼쳤던 새로운 한국을 위한 국민행동(새한국)은 이날도 차량 50대 규모의 집회를 열었다. 이들은 광진구 구의동 추미애 법무부 장관의 아파트 인근에서 출발해 왕십리역과 동대문 등을 거쳐 명동까지 행진한다. 태극기혁명국민운동본부와 우리공화당도 서초구 서울중앙지검과 양재역 인근에 모여 박근혜 전 대통령의 무죄 등을 주장했다."
"전남도, ‘전기화물차 구매’ 최대 2천7백만 원 지원","전라남도가 전기 화물차 구매 보조금을 지원합니다. 지원 물량은 4백 48대로 국고보조금과 시,군비를 더해 한 대당 최대 2천7백60만 원의 보조금을 지원할 계획입니다. 지원대상 지역은 여수와 순천 등 18개 시군으로 자세한 내용은 각 자치단체 누리집에서 확인할 수 있습니다."
"[CSI] ""신차 결함 반복돼도 안바꿔줘""…레몬법 2년 교환 0건","새로 산 자동차에  결함이 있으면 교환·환불해주도록 한   '한국형 레몬법'이  지난해 도입됐습니다. 하지만 지금까지  레몬법이  적용된 경우는 단 한 건도 없습니다. 달리던 중 시동이 꺼지고 가속이 안 돼도 제조사 측은  ""중대 결함이  아니""라며, 소비자에게 뭐가 하자인지 입증하라고 하는 건데요, 이게 일반 소비자에겐.. 하늘의 별따기나 다름없는 일이겠죠.. 소비자탐사대  황민지 기자입니다. 지난해 9월 5000만 원 짜리 쌍용 렉스턴을 구입한 천 모 씨. 언덕길을 올라가 보는데... 엔진소리만 크게 날 뿐 속도는 나지 않습니다. 신차 출고 한 달만에 고속도로나 언던길 주행중 갑자기 속도가 떨어지는 문제가 발생했습니다. 출고한 지 채 1년도 되지 않은 차량은 같은 문제로 6번이나 수리를 받았습니다. 지난해 10월 출고한 벤츠 e클라스 차량도 주행 중 느닷없이 시동이 꺼져 위험한 적이 한두 번이 아닙니다. 그동안 세 차례 수리 받았지만 불안하긴 마찬가지. 이들 차주는 지난해 도입된 한국형 레몬법에 따라 제조사에 교환을 요청했습니다. 레몬법은 신차 구매 1년 이내, 주행거리 2만km를 넘기 전 중대하자가 2회, 일반하자가 3회 이상 생기면 제조사가 차량을 교환·환불해주도록 하고 있습니다. 하지만 교환·환불은 요원한 상태. 제조사 측은 중대하자가 아니라고 주장하고... 레몬법 적용을 받으려면 '자동차 안전·하자 심의위원회'를 거쳐야 합니다. 더욱이 차량 결함은 소비자가 입증해야 합니다. 그나마 계약시 레몬법 적용은 권고 사항이어서 닷지와 지프, 마세라티, 크라이슬러 등은 이마저 거부합니다. 레몬법 시행 2년 동안 중재 접수는 466건인데, 현재까지 교환-환불이 결정된 건 단 한 건도 없습니다. 이 때문에 현행 레몬법으로 차주가 보호 받기란 '하늘의 별따기'란 푸념까지 나옵니다. 소비자탐사대 황민지입니다."
"개천절 행사서 '대화 장면' 포착된 이낙연, 김종인···이 ""공수처·공정3법 논의”","이낙연 더불어민주당 대표와 김종인 국민의힘 비상대책위원장이 3일 개천절 경축식에서 만나 대화를 나눴다. 이날 오전 이낙연 대표와 김종인 위원장이 서울 경복궁 내 국립민속박물관 광장에서 열린 개천절 경축식이 끝난 후 함께 대화하며 이동하는 모습이 ‘연합뉴스’ 등에 보도됐다. 이낙연 대표는 이날 오후 페이스북에 올린 게시물을 통해 “김 위원장과 함께 걸으며 대화했다. 특히 공수처(고위공직자범죄수사처) 출범과 공정경제 3법안 처리에 관해 의미있는 의견 교환이 있었다”면서 “잘 진척시키겠다”고 말했다. 이 대표의 언급을 볼 때 두 사람은 김종인 위원장이 지난달 국민의힘이 곧 공수처장 후보 추천위원을 추천하겠다고 언급한 것과 관련된 대화를 나누었을 가능성이 있다. 국민의힘이 그동안 야당 몫 추천위원 2인을 추천하지 않으면서 공수처 출범도 지연돼 왔다. 이낙연 대표가 페이스북 게시물에서 말한 ‘공정경제 3법’은 현재 정부·여당이 입법 드라이브를 걸고 있는 상법·공정거래법·금융그룹감독법 개·제정안 말한다. 이사회의 독립성을 강화하고, 계열사 일감 몰아주기 규제 대상을 확대하는 내용 등이 담겼다. 공정경제 3법에 대해 김종인 위원장은 국민의힘 다수 의원들보다 좀더 긍정적인 것으로 알려져 있다. 다만 김종인 위원장은 이날 이낙연 대표와의 대화에 대해 말을 아꼈다. 이날 오후 연합뉴스는 김 위원장이 “이 대표와 사적인 이야기만 했다. 그런 얘기(현안 논의) 안 했다”고 말했다고 보도했다."
빅히트 일반 청약 경쟁률 607대 1…58조 몰려,"그룹 방탄소년단 소속사 빅히트엔터테인먼트의 일반 공모주 청약에 58조원이 넘는 증거금이 몰렸습니다. 금융투자업계에 따르면 상장을 주관하는 4개 증권사에 모인 증거금은 모두 58조4,236억원, 통합 청약 경쟁률은 606.97대 1을 기록했습니다. 이는 58조 5,500억여원으로 역대 가장 많은 증거금이 몰렸던 카카오게임즈와 비슷한 수준입니다. 빅히트의 주당 공모가격은 13만5,000원이며 오는 15일 유가증권시장에 상장합니다."
"화천 ASF 발생농장 방역·예찰 강화, 일시이동중지 24시간 연장",ASF 중앙사고수습본부는 화천 양돈농장 ASF 발생에 따른 경기·강원 양돈농장·축산시설·축산차량 스탠드스틸의 시한을 당초 11일 오전 5시에서 12일 오전 5시로 연장한다고 10일 밝혔다. 경기·강원 북부와 인접 지역 양돈농장(375호) 대상 돼지 시료 채취와 정밀검사가 아직 진행 중인 점을 감안한 조치다. 중수본은 지난 9일 화천 양돈농장의 ASF 확진 후 초동방역을 실시하고 있다. 943대의 소독장비를 동원해 전국 양돈농가 6066호에 대한 일제소독을 실시했다. 화천군은 11대의 소독장비를 긴급 투입해 발생농장과 주변 연결도로 등을 집중 소독하고 최근 1개월간 화천군 내 축산차량 통행이 많은 4개 도로(약 20km)도 소독했다. 경기·강원북부와 인접 14개 시군 양돈농가 375호에 대해서는 전화예찰을 실시한 결과 ASF 의심가축 등 특이사항은 발견되지 않았다. 이곳에 대해서는 돼지 혈액시료를 채취해 정밀 검사를 진행 주이다. 이날 오후 4시 기준 78%(293호)의 시료를 채취해 165호 감사를 완료했으며 양성 반응은 없었다. GPS 축산차량 통합관제시스템을 활용해 발생농장과 도축장을 방문한 축산차량이 출입한 다른 양돈농가의 사육돼지 예찰에서도 특이사항이 발견되지 않았다. 중수본은 화천군 양돈 농장 방역 강화를 위해 통제초소와 강원도 내 주요 도로 거점소독시설을 추가 설치·운영하여 소독을 강화할 예정이다. 야생멧돼지 발견 10km 내 방역대 양돈농가를 대상으로 긴급 현장 점검도 실시한다. 농식품부 직원으로 구성한 18개 현장점검반은 농장 입구 차량 소독시설·울타리 등 소독·방역시설의 설치·작동 여부와 축사 출입구 등 생석회 도포 여부 등 농장 방역 이행상태를 점검할 계획이다.
"북한 황해북도 송림 동쪽서 규모 2.5 지진…""자연지진으로 분석""(종합)","진앙은 북위 38.74도, 동경 125.89도이다. 이 지진의 계기진도는 최대 1이다. 계기진도 1은 대부분 사람은 느낄 수 없지만, 지진계에는 기록되는 수준을 말한다. 기상청 관계자는 ""자연 지진으로 분석된다""고 말했다."
에어프라이어로 조리한 샌드위치 맛보세요 [포토뉴스],4일 서울 이마트 트레이더스 월계점에서 모델들이 신세계푸드에서 만든 에어프라이어 전용 냉동 샌드위치 ‘밀크앤허니 바질치즈 치아바타 샌드위치’를 소개하고 있다.
공군 최우수 통제사 ‘골든아이’에 전성환·김병용 준위,공군은 최우수 방공무기통제사에 전성환(29)·김병용(32) 준위를 선발했다고 20일 밝혔다. ‘골든아이’로 불리는 최우수 방공무기통제사로 뽑힌 전 준위와 김 준위는 2015년 특별 임용시험을 통해 항공통제 임무를 수행하는 방공무기통제 준사관 5기로 임관했다. 공군 중앙방공통제소(MCRC)에서 근무하는 통제사의 작전 능력을 평가하는 지상통제체계 부문에 선정된 전 준위는 “공군의 최일선에서 조국 영공방위에 참여한다는 것에 큰 자부심을 느꼈다”고 소감을 밝혔다. E-737 조기경보기에서의 통제 능력을 평가하는 공중통제체계 부문에 선발된 김 준위는 “동료 및 후배 통제사들의 기량 증진에 도움이 될 수 있도록 힘쓰겠다”고 말했다. 방공무기통제사는 공중으로 침투하는 적기를 격추하기 위해 아군 요격기를 인도하는 임무를 수행한다.
